{
  "schemaVersion": "1.0.0",
  "source": "analysis/gap-analysis-astryx/plans/prioritized-roadmap-implementation-plan.md",
  "sourceDigest": "sha256:7fdc84397497f55814a4828e9baf4acea4cebf861e5de9bc107e63d026bbde65",
  "criteria": [
    {
      "id": "R01.1",
      "requirement": "Every public component, recipe, A2UI type, and foundation topic is indexed",
      "deliverable": "P0-A registry",
      "automatedVerification": "source-set equality",
      "manualEvidenceAndOwner": "Design Systems/Developer Experience inventory review",
      "releaseGate": "P0-A"
    },
    {
      "id": "R01.2",
      "requirement": "Search returns mixed kinds with stable IDs",
      "deliverable": "P0-A search/API",
      "automatedVerification": "mixed-query contract tests",
      "manualEvidenceAndOwner": "Developer Experience API review",
      "releaseGate": "P0-A"
    },
    {
      "id": "R01.3",
      "requirement": "Deprecated entries retain replacements",
      "deliverable": "P0-A lifecycle metadata",
      "automatedVerification": "relation/schema checks",
      "manualEvidenceAndOwner": "Governance review",
      "releaseGate": "P0-A"
    },
    {
      "id": "R01.4",
      "requirement": "Registry is deterministic and versioned",
      "deliverable": "P0-A generator",
      "automatedVerification": "two-run byte identity/version tests",
      "manualEvidenceAndOwner": "Release Engineering review",
      "releaseGate": "P0-A"
    },
    {
      "id": "R02.1",
      "requirement": "Typed envelopes, append-only errors, capabilities, shared pure functions, and correlated versions",
      "deliverable": "P0-B tooling",
      "automatedVerification": "schema/parity/version tests",
      "manualEvidenceAndOwner": "Developer Experience review",
      "releaseGate": "P0-B"
    },
    {
      "id": "R02.2",
      "requirement": "`init` idempotently manages AGENTS, cursorrules, MCP, and optional scripts",
      "deliverable": "P0-B operations",
      "automatedVerification": "mutation/replay fixtures",
      "manualEvidenceAndOwner": "Security/Release Engineering recovery review",
      "releaseGate": "P0-B"
    },
    {
      "id": "R02.3",
      "requirement": "Clean Vite/Next projects install, initialize, search, plan, generate, and validate without the monorepo",
      "deliverable": "P0-B validator/tooling",
      "automatedVerification": "packed end-to-end fixtures",
      "manualEvidenceAndOwner": "Developer Experience acceptance",
      "releaseGate": "P0-B"
    },
    {
      "id": "R02.4",
      "requirement": "Manifest drift and JSON schemas are CI-gated",
      "deliverable": "P0-B CI",
      "automatedVerification": "drift/schema jobs",
      "manualEvidenceAndOwner": "Release Engineering review",
      "releaseGate": "P0-B"
    },
    {
      "id": "R02.5",
      "requirement": "Agent cold-start discovery is measured before/after init",
      "deliverable": "P0-B benchmark",
      "automatedVerification": "reproducible benchmark artifact",
      "manualEvidenceAndOwner": "Developer Experience evaluation",
      "releaseGate": "P0-B"
    },
    {
      "id": "R03.1",
      "requirement": "Ten named templates have metadata, source, skeleton, dependencies, preview, golden, and version",
      "deliverable": "P0-C templates",
      "automatedVerification": "exact inventory/schema/pack tests",
      "manualEvidenceAndOwner": "Design Systems review",
      "releaseGate": "P0-C"
    },
    {
      "id": "R03.2",
      "requirement": "Template list, skeleton, and add commands work",
      "deliverable": "P0-C tooling",
      "automatedVerification": "command/API tests",
      "manualEvidenceAndOwner": "Developer Experience review",
      "releaseGate": "P0-C"
    },
    {
      "id": "R03.3",
      "requirement": "Add refuses destructive overwrites and reports files",
      "deliverable": "P0-C materializer",
      "automatedVerification": "safety/recovery fixtures",
      "manualEvidenceAndOwner": "Security review",
      "releaseGate": "P0-C"
    },
    {
      "id": "R03.4",
      "requirement": "Materialized code passes installed validation and TypeScript",
      "deliverable": "P0-C validator",
      "automatedVerification": "packed Vite/Next valid-output tests",
      "manualEvidenceAndOwner": "Developer Experience review",
      "releaseGate": "P0-C"
    },
    {
      "id": "R03.5",
      "requirement": "Templates render in light and dark",
      "deliverable": "P0-C previews",
      "automatedVerification": "visual snapshots",
      "manualEvidenceAndOwner": "Design Systems/Accessibility QA",
      "releaseGate": "P0-C"
    },
    {
      "id": "R04.1",
      "requirement": "All ten Table candidates are assessed and plugins share state",
      "deliverable": "P0-D/P1-F",
      "automatedVerification": "candidate equality/controller tests",
      "manualEvidenceAndOwner": "Design Systems review",
      "releaseGate": "P0-D/P1-F"
    },
    {
      "id": "R04.2",
      "requirement": "Keyboard/screen-reader behavior remains React Aria-compatible",
      "deliverable": "P1-F",
      "automatedVerification": "interaction/a11y tests",
      "manualEvidenceAndOwner": "Accessibility QA",
      "releaseGate": "P1-F"
    },
    {
      "id": "R04.3",
      "requirement": "Server sorting/filtering/pagination are first-class",
      "deliverable": "P1-F controller",
      "automatedVerification": "request/stale/cancel tests",
      "manualEvidenceAndOwner": "Developer Experience review",
      "releaseGate": "P1-F"
    },
    {
      "id": "R04.4",
      "requirement": "Controlled/uncontrolled forms follow Tale conventions",
      "deliverable": "P1-F",
      "automatedVerification": "state/SSR tests",
      "manualEvidenceAndOwner": "Design Systems review",
      "releaseGate": "P1-F"
    },
    {
      "id": "R04.5",
      "requirement": "1k/10k benchmarks and current-API migration exist",
      "deliverable": "P0-D/P1-F",
      "automatedVerification": "benchmarks/migration fixtures",
      "manualEvidenceAndOwner": "Performance/Release Engineering review",
      "releaseGate": "P1-F"
    },
    {
      "id": "R05.1",
      "requirement": "Ordered version manifests cover JS/TS, CSS, and project config",
      "deliverable": "P1-A migrations",
      "automatedVerification": "manifest/loader/transform tests",
      "manualEvidenceAndOwner": "Developer Experience review",
      "releaseGate": "P1-A"
    },
    {
      "id": "R05.2",
      "requirement": "Dry-run diff/report, idempotency, fixtures, and deprecation links exist",
      "deliverable": "P1-A operations",
      "automatedVerification": "postimage/replay/relation tests",
      "manualEvidenceAndOwner": "Release Engineering review",
      "releaseGate": "P1-A"
    },
    {
      "id": "R05.3",
      "requirement": "All four prescribed starter groups ship with verified ranges",
      "deliverable": "P1-A migrations",
      "automatedVerification": "exact inventory/per-group compatibility tests",
      "manualEvidenceAndOwner": "Developer Experience/Release Engineering review",
      "releaseGate": "P1-A"
    },
    {
      "id": "R06.1",
      "requirement": "Current and one previous major are hosted",
      "deliverable": "P1-B docs",
      "automatedVerification": "provenance/route tests",
      "manualEvidenceAndOwner": "Docs Platform review",
      "releaseGate": "P1-B"
    },
    {
      "id": "R06.2",
      "requirement": "Root `llms.txt` points to CLI and hosted MCP",
      "deliverable": "P1-B assembly",
      "automatedVerification": "deployed-route/content tests",
      "manualEvidenceAndOwner": "Docs Platform review",
      "releaseGate": "P1-B"
    },
    {
      "id": "R06.3",
      "requirement": "Hosted MCP exposes retrieval plus `plan_ui`, not validation",
      "deliverable": "P1-B runtime",
      "automatedVerification": "capability/absence/load tests",
      "manualEvidenceAndOwner": "Security review",
      "releaseGate": "P1-B"
    },
    {
      "id": "R06.4",
      "requirement": "Responses include registry version/source and budgets are documented",
      "deliverable": "P1-B contracts",
      "automatedVerification": "response/budget tests",
      "manualEvidenceAndOwner": "Developer Experience review",
      "releaseGate": "P1-B"
    },
    {
      "id": "R07.1",
      "requirement": "Tale-owned strings are inventoried with keys and English catalog",
      "deliverable": "P1-C i18n",
      "automatedVerification": "inventory/schema tests",
      "manualEvidenceAndOwner": "Localization review",
      "releaseGate": "P1-C"
    },
    {
      "id": "R07.2",
      "requirement": "Pseudo-locale, RTL, overrides, contribution workflow, context, and screenshots exist",
      "deliverable": "P1-C operations",
      "automatedVerification": "fallback/RTL/SSR tests",
      "manualEvidenceAndOwner": "Localization/Accessibility QA",
      "releaseGate": "P1-C"
    },
    {
      "id": "R07.3",
      "requirement": "Application-owned copy remains outside Tale catalogs",
      "deliverable": "P1-C boundary",
      "automatedVerification": "inventory allowlist tests",
      "manualEvidenceAndOwner": "Localization review",
      "releaseGate": "P1-C"
    },
    {
      "id": "R08.1",
      "requirement": "Dashboard covers downloads/version, docs/search, errors, templates, codemods, issues, health, and cadence/lag where evidenced",
      "deliverable": "P1-D metrics",
      "automatedVerification": "coverage/freshness schemas",
      "manualEvidenceAndOwner": "Product Analytics review",
      "releaseGate": "P1-D"
    },
    {
      "id": "R08.2",
      "requirement": "Project telemetry is opt-in, minimal, documented, removable, and separate",
      "deliverable": "P1-D privacy",
      "automatedVerification": "capability/consent/absence tests",
      "manualEvidenceAndOwner": "Privacy/Security review",
      "releaseGate": "P1-D"
    },
    {
      "id": "R09.1",